Author,Date,Rating,Helpful count,Review,Picture included,Language,(view source)
金子明,2022-12-20 10:57:37,4,0," Head to Sagano and first visit Tendai sect Nison-in Temple.
Unfortunately, it was about a month early for autumn leaves, but they started to color for a minute.
After walking along the quiet autumnal approach to the temple, we headed to the main hall, which enshrined two Buddha statues, Shaka Nyorai and Amida Nyorai, which were created by Kasuga Buddhist sculptor in the mid-Kamakura period.
Nison-in, which stands at the eastern foot of Mt. Ogura, was written in the Ogura Hyakunin Isshu, and I was able to spend a quiet time.

",yes,Japanese,view review
Amy K,2023-01-09 09:14:49,5,0," I heard it for the first time. It was a very well-maintained temple, and everywhere was clean. I also experienced bell ringing for the first time in my life.

",yes,Japanese,view review
みねやん,2023-01-12 21:37:50,4,0," The temple enshrines two deities, Shaka Nyorai and Amida Nyorai, and is officially called 'Ogurayama Nisonkyoin Kedai-ji', and was built by Emperor Saga's imperial request.
The long and wide approach to Mt. Ogura, which passes through the main gate, visually expands and gives you a sense of calmness. I think that the refreshing feeling of the fresh green season, the strength of the summer, and the glamorous colors of the mountains and autumn foliage in the fall.
The main hall is also really comfortable, and I think it is a luxurious space to sit in the corridor of the Indian summer, quietly contemplate, and feel the periodic sound of Shishiodoshi.
The precincts are wide and you can climb the stone steps further and enjoy the view of Kyoto city from the Arashiyama area.

",yes,Japanese,view review
樽谷英樹,2023-02-04 05:49:51,4,0," I walked about 5 minutes from Jojakko-ji Temple.

The origin of the name of [Nison-in] is that two bodies, [Shaka Nyorai] and [Amida Nyorai] are enshrined.

Together with Tathagata who will guide us from now on
The other one is the Tathagata who will guide us after we die😌

I personally liked the autumn leaves 🍁 at [Jojakkoji] better 😌

",yes,Japanese,view review
Senthil Kumar,2023-02-21 04:51:39,4,0,Beautiful place to feel peace with nature connection 💕,no,,view review
伊勢守,2023-03-06 01:11:24,5,0," Nison-in is a temple of the Tendai sect of Buddhism and has the same mountain name as Jojakko-ji Temple, which is located to the south. It is also one of the traditional places of ""Shiguretei"" which is Ogura Sanso of Teika Fujiwara. At the boundary between Nison-in Temple and Jojakko-ji Temple, there is a stone monument that says 'the place where Ogura Hyakunin Isshu was compiled'. There is also a theory that the mountain villa straddled both temples.
It was founded in the Heian period, but since it was revived by a disciple of Honen in the early Kamakura period, it was strongly influenced by the Jodo sect, but it seems that it officially belonged to the Tendai sect in the Edo period. There are many graves of famous people such as Sanetaka Sanjonishi, Ryoi Kadokura, Jinsai Ito and his son Togai, and Tsumasaburo Bando. The wide stone-stepped slopes are often used as filming locations for period dramas, and have been seen many times in movies and TV dramas.
The third image is the tomb of the Sanjonishi family, a court noble who produced many poets and scholars. The tombs of Sanetaka, Kojo, and Sanue, who were active from the late Muromachi period to the Azuchi-Momoyama period, are lined up.

",yes,Japanese,view review
I H,2023-03-08 09:16:19,5,0," On September 25th, 2020, I walked from Saga-Arashiyama Station on the JR Sagano Line, walked around Sagano, and went to Nison-in.

Nison-in is said to be the birthplace of Ogura Hyakunin Isshu and Ogura bean jam, just as it is called Ogurayama.

It is said that the origin of the name of the temple is that it enshrines Shaka Nyorai and Amida Nyorai as its principal images.

When you pass through the main gate, the approach stretches in a straight line, and the branches of autumn leaves cover the approach from both sides, so I wanted to come during the autumn leaves season🍁

You can ring the bell of the bell tower at Nison-in Temple 😀 It is called the Bell of Happiness

There is the grave of Ryoi Suminokura❗️Also, the view from the site of Fujiwara no Teika's Shigure-tei is the best😊

",yes,Japanese,view review
TORU,2023-03-16 22:00:34,5,0," By the time I got here, the number of tourists in Arashiyama had decreased considerably. Admission fee is 500 yen. Important cultural properties of Shaka Nyorai and Amida Nyorai are enshrined here. Waka poems related to this place are posted here and there, and it is remembered that it became a place for selection of Hyakunin Isshu. It was a well-maintained temple with many attractions.

",yes,Japanese,view review
成澤小百合,2023-03-29 10:57:37,5,0," The principal images of Buddha are Shaka Nyorai, who sends those who aim for paradise from this shore, and Amida Nyorai, who invites them to the other shore (both important cultural properties). At the main hall, you will be greeted by two very similar deities standing side by side. If you put your hands together in front of it, you will feel relieved. In the precincts, there is also the grave of Ryoi Suminokura, who was a wealthy merchant in Kyoto who worked hard on river civil engineering.

",yes,Japanese,view review
yura,2023-03-31 07:28:29,4,0," I visited to see the rickshaw decorated with many flowers. It was very beautiful and glossy, even from behind it was elaborate🌼🌸💠

",yes,Japanese,view review
neko mothiran,2023-04-07 23:19:34,5,0," The cherry blossoms were still blooming. The leaves turned blue and were beautiful. The flower guruma that welcomes you is beautiful

",yes,Japanese,view review
Simone Passacantilli,2023-04-14 07:05:25,5,0,Fantastic craftsmanship in a magic atmosphere,no,,view review
と金,2023-04-20 10:24:39,5,0," There is a distance from the station, but it is a very good temple.
I received a goshuin of Kuzuryu Benzaiten.
You can spend your time leisurely as the waiting time is somewhat depressing.

",yes,Japanese,view review
中村桜子,2023-04-25 12:27:28,5,0," It was a rainy day on April 25th, but the fresh green was very beautiful. The spacious precincts are full of highlights. Please visit once.

",yes,Japanese,view review
たけほがら,2023-05-02 13:53:09,5,0," I came here when the cherry blossoms were in full bloom. The slope leading from the main gate to the black gate and the imperial messenger gate was covered with pale cherry blossoms.

Passing through the imperial gate, there were large cherry trees on the left and right, and the branches seemed to bend with the flowers in full bloom.

This temple was founded by the imperial request of Emperor Saga, and is said to have been named Nison-in because it enshrines two deities, 'Shaka Nyorai' and 'Amida Nyorai'.

This is a place where you can enjoy both the autumn leaves season and the cherry blossom season. You will surely be able to enjoy the wonderful scenery even during the fresh green season. Next comes the season of fresh green.
(Visit: 2023-03-29)

",yes,Japanese,view review
326,2023-05-07 10:18:26,5,0," I wanted to go to Nison-in Temple! I saw it on TV and decided to go! It felt like I was already soaring after entering the temple gate. Amida Nyorai and Shaka Nyorai in the main hall... What a luxury...
As the two main deities were holding their hands over me, I felt that they were receiving a great deal of attention.

",yes,Japanese,view review
YH Tee,2023-05-08 12:01:32,5,0,"It is a quiet temple away from the tourists. We were there in mid April.


",yes,,view review
Ben Hsu,2023-05-17 01:57:51,5,0,"Nisonin [or Nison-in] Temple [the Temple] is located within very short walking distance from Seiryoji Temple of Saga area, Kyoto. It worships Great Buddha, although it also worships other Buddhist deities which have Chinese or Japanese origination inside the Temple courtyard.

The Temple was created in the 9th Century with the blessing of then Emperor Saga, although it was rebuilt around 15th century due to Onin War, because the Temple had close relations with the Imperial Family. From the Meiji era, Nisonin Temple belongs to the Tendai sect of Buddhism.

For many visitors and worshippers, the Temple is famous for its garden beauty- cheery blossom in March to early April, hydrangeas in late Spring and colorful foliage of the Japanese maples in fall, and they are planted along the main road from the main gate to the main worship hall. Another strength or uniqueness of the Temple is its serenity in silence in the garden and courtyard when visitors can also enjoy the beauty of the garden.


























",yes,,view review
Akemi (ミニ苺パフェ),2023-05-18 12:59:29,5,0," The fresh greenery of Nison-in Temple was wonderful.
Fresh greenery, chirping birds, beautiful and forgetting the hustle and bustle of the world.

",yes,Japanese,view review
ひまわり桜,2023-05-25 13:05:50,4,0," 2023/5/21
Blue maple is wonderful
There are fewer people than during the fall foliage season, so you can spend a leisurely time
The main gate was relocated from Fushimi Castle.

",yes,Japanese,view review
idaline payet,2023-05-27 02:09:52,5,0," I was dazzled by the green of the surrounding nature, it is very pleasant calm. I would like to come back in the fall ♡

",yes,French,view review
michy,2023-05-31 12:42:34,5,0," The autumn foliage on the approach to the shrine is spectacular and worth seeing. The garden and the view of Rakuchu (city center) are wonderful. It is also famous as a temple where the graves of Mr. Takahiro, the eldest of the three Tamura brothers, and his father, Mr. Bando Tsumasaburo.

",yes,Japanese,view review
えーちゃん2,2023-06-01 08:26:36,4,0," I visited Honen Shonin's 25 sacred grounds.
It is a temple of the Tendai sect and is a 15 to 20 minute walk from Randen Arashiyama Station.
There is a small path of Tenryu-ji Temple and a bamboo grove on the way on foot.

",yes,Japanese,view review
Sun Rose,2023-06-02 05:17:54,2,0," I visited in the afternoon of GW.
As I passed through the main gate and walked along the approach to the shrine lined with beautiful fresh green foliage, I began to feel a little uneasy. And the anxiety gradually increased.
The anxiety was that workers were cleaning the garden of the main hall with a machine. The problem is not the sight, but the ""sound"". There is no escape from noise.
The horrifying mechanical noise reverberated throughout the main hall from around the time I passed through the imperial gate.
The pamphlet at the reception said, ""Please listen carefully to the trees and birds chirping in the silence.""
If it weren't for the noise, I think I would have been able to feel a sense of calm and bliss.
It was unfortunate that I could go to this famous temple once in my life.

",no,Japanese,view review
